session_date_utc,anonymous_user_id,completed,time_to_complete_minutes,failed_steps,severity,friction_notes
2026-02-19T04:43:53Z,pilot-user-01,yes,0.13,none,none,"Scripted pilot run passed full MVP flow (blank -> edit -> export -> reset -> import). No console/page errors."
2026-02-19T04:44:01Z,pilot-user-02,yes,0.13,none,none,"Scripted pilot run passed all checks. Menu close, search mode, and session reload behavior were stable."
2026-02-19T04:44:08Z,pilot-user-03,yes,0.12,none,none,"Scripted pilot run passed all checks. No data loss or interaction regressions detected."
2026-02-19T04:44:23Z,pilot-user-04,yes,0.12,none,none,"Scripted pilot run passed all checks. Inspector and edge editing contexts remained correct."
2026-02-19T04:44:31Z,pilot-user-05,yes,0.13,none,none,"Scripted pilot run passed all checks. Follow-up still recommended: add 3-5 human external users for qualitative discoverability feedback."
2026-02-19T05:50:07Z,pilot-user-06,yes,0.13,none,none,"Scripted pilot rerun passed full flow on current branch and env; no console/page errors."
